{"artifact_role":"parameter_registry","config_hash":"544914346d74e77c9822108a30b593191d834e16cea7be02ff0ff0c89b13e07e","core_evidence":{"alias_resolves_to":"weight","coordinate_registry_hash":"cbe824a026bd0901ccc96d6c65e29849f9533ebdcbe57b897b2ee818de44cd3a","eligible_names":["bias","weight"],"eligible_numel":6,"evidence_type":"parameter_registry","optimizer_contract_hash":"a95f04f5eddcdd5a6441b89289c7fc33a5cb01078ca53bc8cc348bee742f363b","registry_manifest":{"coordinate_registry_hash":"cbe824a026bd0901ccc96d6c65e29849f9533ebdcbe57b897b2ee818de44cd3a","optimizer_contract_hash":"a95f04f5eddcdd5a6441b89289c7fc33a5cb01078ca53bc8cc348bee742f363b","optimizer_groups":[{"group_id":"group_0000","learning_rate":0.1,"parameter_names":["bias","weight"],"static_options":{"dampening":0,"differentiable":false,"foreach":false,"fused":null,"maximize":false,"momentum":0,"nesterov":false,"weight_decay":0},"weight_decay":0.0}],"optimizer_type":"torch.optim.sgd.SGD","records":[{"aliases":[],"canonical_name":"bias","device":"cpu","dtype":"torch.float32","eligibility_reason":"eligible_dense_unique_storage","eligible":true,"group_id":"group_0000","layout":"torch.strided","learning_rate":0.1,"numel":2,"order":0,"shape":[2],"stride":[1],"tags":{"layer":"bias","module":"<root>","module_type":"other","parameter_role":"bias"},"weight_decay":0.0},{"aliases":["weight_alias"],"canonical_name":"weight","device":"cpu","dtype":"torch.float32","eligibility_reason":"eligible_dense_unique_storage","eligible":true,"group_id":"group_0000","layout":"torch.strided","learning_rate":0.1,"numel":4,"order":1,"shape":[2,2],"stride":[2,1],"tags":{"layer":"weight","module":"<root>","module_type":"other","parameter_role":"weight"},"weight_decay":0.0}],"runtime_layout_hash":"42f48a6496c886fe6fa520a5306f07e5aff95fbd1db998b6d635a201bf63b4e1","schema_version":"parameter-registry-v1"},"registry_validation_report":{"checks":[{"check_id":"manifest_roundtrip_hashes","status":"PASS"},{"check_id":"canonical_alias_resolution","status":"PASS"},{"check_id":"eligible_numel_sum","status":"PASS"},{"check_id":"state_schema_registry_binding","status":"PASS"}],"consumer_commit":"3169dd01cae66dfce67cd1139a25239b7941af57","execution_scope":"local_cpu_contract_only","gate_id":"G1-REGISTRY","producer_commit":"3169dd01cae66dfce67cd1139a25239b7941af57","registry":{"coordinate_registry_hash":"cbe824a026bd0901ccc96d6c65e29849f9533ebdcbe57b897b2ee818de44cd3a","eligible_numel":6,"optimizer_contract_hash":"a95f04f5eddcdd5a6441b89289c7fc33a5cb01078ca53bc8cc348bee742f363b","record_count":2,"runtime_layout_hash":"42f48a6496c886fe6fa520a5306f07e5aff95fbd1db998b6d635a201bf63b4e1"},"schema_version":"g1-registry-report-v1","status":"NOT_RUN"},"runtime_layout_hash":"42f48a6496c886fe6fa520a5306f07e5aff95fbd1db998b6d635a201bf63b4e1","state_schema":{"accumulation_dtype":"float32","byte_order":"little","registry_hash":"cbe824a026bd0901ccc96d6c65e29849f9533ebdcbe57b897b2ee818de44cd3a","schema_version":"stage1-importance-state-v1","slot_names":["s1","s2","signed","positive","negative_mass","absolute","raw","data_movement","net_data_movement","magnitude","actual_update_raw_importance"],"slots":{"absolute":{"dtype":"float32","fields":[{"canonical_name":"bias","numel":2,"shape":[2]},{"canonical_name":"weight","numel":4,"shape":[2,2]}]},"actual_update_raw_importance":{"dtype":"float32","fields":[{"canonical_name":"bias","numel":2,"shape":[2]},{"canonical_name":"weight","numel":4,"shape":[2,2]}]},"data_movement":{"dtype":"float32","fields":[{"canonical_name":"bias","numel":2,"shape":[2]},{"canonical_name":"weight","numel":4,"shape":[2,2]}]},"magnitude":{"dtype":"float32","fields":[{"canonical_name":"bias","numel":2,"shape":[2]},{"canonical_name":"weight","numel":4,"shape":[2,2]}]},"negative_mass":{"dtype":"float32","fields":[{"canonical_name":"bias","numel":2,"shape":[2]},{"canonical_name":"weight","numel":4,"shape":[2,2]}]},"net_data_movement":{"dtype":"float32","fields":[{"canonical_name":"bias","numel":2,"shape":[2]},{"canonical_name":"weight","numel":4,"shape":[2,2]}]},"positive":{"dtype":"float32","fields":[{"canonical_name":"bias","numel":2,"shape":[2]},{"canonical_name":"weight","numel":4,"shape":[2,2]}]},"raw":{"dtype":"float32","fields":[{"canonical_name":"bias","numel":2,"shape":[2]},{"canonical_name":"weight","numel":4,"shape":[2,2]}]},"s1":{"dtype":"float32","fields":[{"canonical_name":"bias","numel":2,"shape":[2]},{"canonical_name":"weight","numel":4,"shape":[2,2]}]},"s2":{"dtype":"float32","fields":[{"canonical_name":"bias","numel":2,"shape":[2]},{"canonical_name":"weight","numel":4,"shape":[2,2]}]},"signed":{"dtype":"float32","fields":[{"canonical_name":"bias","numel":2,"shape":[2]},{"canonical_name":"weight","numel":4,"shape":[2,2]}]}}}},"core_evidence_hash":"ea9f39405347ced4943f162a6b459441256f7229eb4a8d5951cb9b4a437cec63","gate_status":"NOT_RUN","input_evidence":[],"local_validation_status":"PASS","role_evidence":{"canonical_order":true,"identity_bound":true,"role":"frozen_manifest"},"schema_version":"stage01-task-evidence-v1","scope":"local_fixture","task_definition_hash":"da02079ee31a9938a613f3aef2d33bf8d24a4323d0f3cc5413aa1a9fff72bf2d","task_id":"stage1.02_architecture_and_parameter_registry"}
