{"artifact_role":"gate_record","config_hash":"77d1f1c51f51c8c4916b4552a03834b32c594871c4c0f395a8232f935fb54354","core_evidence":{"active_after_retention":["state-0002"],"active_before_retention":["state-0001","state-0002"],"bundle_manifest_sha256":"145a3ebfcd6d71649a39634684638cec12fc3702f45ca1ea7cdc2f6536edc3d9","checkpoint_id":"state-0002","evidence_type":"checkpoint_resume","generation":2,"newly_tombstoned":["state-0001"],"objects_deleted":0,"reconcile_invalid":[],"resume_equivalent":true,"two_phase_commit":true},"core_evidence_hash":"2aeca25c5c53d4c9fb56565a35e49d6c50a14017ff30c410b752e6e9747d30d5","gate_status":"NOT_RUN","input_evidence":[],"local_validation_status":"PASS","role_evidence":{"decision_authority":"external_reviewer","gate_status":"NOT_RUN","role":"gate_candidate"},"schema_version":"stage01-task-evidence-v1","scope":"local_fixture","task_definition_hash":"ff9ccfb34ba7a91b965794dc6a991ac2d9fb7e0f9040642afbf662d337d8ddd9","task_id":"stage1.10_checkpoint_resume_and_artifacts"}
