{"artifact_role":"estimator_validation_report","config_hash":"7d9a68717c403bd89224b3b62ca19e548af185a7f6ad1f888b0ab5c654a795b0","core_evidence":{"comparisons":{"double":{"absolute_threshold":4e-12,"atol":1e-12,"branch":"scaled_nonzero","comparison_dtype":"torch.float64_cpu","max_absolute_error":0.0,"natural_scale":4.0,"near_zero_threshold":4e-11,"nonfinite_count":0,"normalized_l2_error":0.0,"normalized_l2_limit":1e-10,"passed":true,"rtol":1e-10,"scaled_max_error":0.0,"worst_parameter":"weight"},"raw":{"absolute_threshold":4e-12,"atol":1e-12,"branch":"scaled_nonzero","comparison_dtype":"torch.float64_cpu","max_absolute_error":0.0,"natural_scale":4.0,"near_zero_threshold":4e-11,"nonfinite_count":0,"normalized_l2_error":0.0,"normalized_l2_limit":1e-10,"passed":true,"rtol":1e-10,"scaled_max_error":0.0,"worst_parameter":"weight"},"u":{"absolute_threshold":4e-12,"atol":1e-12,"branch":"scaled_nonzero","comparison_dtype":"torch.float64_cpu","max_absolute_error":0.0,"natural_scale":4.0,"near_zero_threshold":4e-11,"nonfinite_count":0,"normalized_l2_error":0.0,"normalized_l2_limit":1e-10,"passed":true,"rtol":1e-10,"scaled_max_error":0.0,"worst_parameter":"weight"}},"double":{"weight":[6.0,0.0]},"evidence_type":"importance_estimators","raw":{"weight":[6.25,0.25]},"same_batch_clipped_u_claim":"plugin_same_batch_clip_no_strict_unbiasedness","u":{"weight":[5.833333333333333,-0.16666666666666666]},"u_can_be_negative":true,"unclipped_u_claim":"unbiased_fixed_state_under_declared_sampling_assumptions"},"core_evidence_hash":"69a034240ed58a0478cbf6c111ae31b53c2e05ede1b54316c335be4b2b8bf631","gate_status":"NOT_RUN","input_evidence":[],"local_validation_status":"PASS","role_evidence":{"manual_numeric_edits":false,"role":"derived_report","source":"task_core_evidence"},"schema_version":"stage01-task-evidence-v1","scope":"local_fixture","task_definition_hash":"ffa42a4826e51f75a3701921511e9807e047bd4f87d6fb6a4289ee10f1e5348f","task_id":"stage1.05_estimators"}
