{"artifact_role":"fixture_manifest","config_hash":"0f7f318b144cf1064df4aac88540660d53500957187046152ff429f55e50dbd5","core_evidence":{"comparison":{"absolute_threshold":4e-12,"atol":1e-12,"branch":"scaled_nonzero","comparison_dtype":"torch.float64_cpu","max_absolute_error":0.0,"natural_scale":4.0,"near_zero_threshold":4e-11,"nonfinite_count":0,"normalized_l2_error":0.0,"normalized_l2_limit":1e-10,"passed":true,"rtol":1e-10,"scaled_max_error":0.0,"worst_parameter":"weight"},"evidence_type":"fp64_fixture_oracle","fixture_scope":"local_fixture","mean_gradient":{"weight":[2.5,0.5]},"sample_count":4,"u_oracle":{"weight":[5.833333333333333,-0.16666666666666666]}},"core_evidence_hash":"0dbcba27b3a974192dfe92e3a8844cc9ed1be64ba307132db518659b16943a75","gate_status":"NOT_RUN","input_evidence":[],"local_validation_status":"PASS","role_evidence":{"canonical_order":true,"identity_bound":true,"role":"frozen_manifest"},"schema_version":"stage01-task-evidence-v1","scope":"local_fixture","task_definition_hash":"d9ac84e94813e4b590818f1bafd6868da3b1767a228290e8a7dbd6a78b20d78f","task_id":"stage1.03_fixtures_and_oracles"}
