{"artifact_role":"skip_lifecycle_report","config_hash":"b8ccb18cdc0ffabf6512c867af8f91505d1b7489a9926c5faa6e2bd12d190c10","core_evidence":{"adamw_decomposition_max_error":3.725290298461914e-09,"adamw_learning_rate":0.1,"evidence_type":"numeric_optimizer_boundary","foreach":false,"fused":false,"global_clip_factor":0.49999999999989997,"global_norm":5.0,"gradient_lifecycle":{"clip_factor":0.49999999999989997,"global_norm":5.0,"gradient_scale":2.0,"missing_names":["unused"],"phase":"CLIPPED","skip_reason":null},"nonfinite_phase":"SKIPPED","nonfinite_skip_reason":"NONFINITE_UNSCALED_GRADIENT"},"core_evidence_hash":"2d4dbf8e6ece2b69fcaefc27b53d09a6b7fecb7e3c7ada6016ee09d447b77279","gate_status":"NOT_RUN","input_evidence":[],"local_validation_status":"PASS","role_evidence":{"manual_numeric_edits":false,"role":"derived_report","source":"task_core_evidence"},"schema_version":"stage01-task-evidence-v1","scope":"local_fixture","task_definition_hash":"8bedcb14b3b5e6e6b1a36a74af0e5037a1757de3d4ba6f80faf7f78ba6e9e323","task_id":"stage1.09_precision_clipping_and_optimizer_boundaries"}
