{"artifact_role":"stage_report","config_hash":"a462a3baa3ce16920688bf82204686bea3196f0bfd9e40d7d564f808a083a41f","core_evidence":{"evidence_type":"stage1_exit_report","formal_gate_status":"NOT_RUN","local_evidence_only":true,"manual_numbers_allowed":false,"requirements":["contract","parameter_registry","fp64_oracle","loss_gradient_scale","estimators","training_integration","ddp","numeric_boundaries","checkpoint_resume"],"server_validation":"BLOCKED:server_unreachable"},"core_evidence_hash":"803117dc2c1fae5b24bb1cee8a5b5c5d0addfa645d8c6012e750b68a44e47821","gate_status":"NOT_RUN","input_evidence":[],"local_validation_status":"PASS","role_evidence":{"manual_numeric_edits":false,"role":"derived_report","source":"task_core_evidence"},"schema_version":"stage01-task-evidence-v1","scope":"local_fixture","task_definition_hash":"57f7acd9e70a220450cfd8c45a93eddb11c67cf896537f29265f484af5c28f30","task_id":"stage1.11_reporting_and_exit_gate"}
