{"artifact_role":"gradient_scale_report","config_hash":"3412941027c937034f42d34f12c4accb96a52eacb642552e301f303ecc008d07","core_evidence":{"causal_lm":{"effective_count":2,"numerator":7.1317678075148585,"statistical_unit":"target_token"},"classification":{"effective_count":2,"numerator":0.2538560220859452,"statistical_unit":"sample"},"evidence_type":"loss_and_gradient_scale","merge_uses_numerator_denominator":true,"merged_effective_count":3},"core_evidence_hash":"a20cec6180ff31b63462ef155e4f992644a781bcdba24c3bcc0983a7a70c8dfa","gate_status":"NOT_RUN","input_evidence":[],"local_validation_status":"PASS","role_evidence":{"manual_numeric_edits":false,"role":"derived_report","source":"task_core_evidence"},"schema_version":"stage01-task-evidence-v1","scope":"local_fixture","task_definition_hash":"1e1db04e825a7cd15e8121bf8d5e2768d3cdda137ff4a2f046c3de34d3a1fa3d","task_id":"stage1.04_loss_and_gradient_scale"}
