{"artifact_role":"gate_record","config_hash":"544914346d74e77c9822108a30b593191d834e16cea7be02ff0ff0c89b13e07e","core_evidence":{"alias_resolves_to":"weight","coordinate_registry_hash":"0c4cff651e4c1d95c386d9e189316f4d5cd2d90d14d2401cd5baaeb0f8b61690","eligible_names":["weight","bias"],"evidence_type":"parameter_registry","optimizer_contract_hash":"a95f04f5eddcdd5a6441b89289c7fc33a5cb01078ca53bc8cc348bee742f363b","records":[{"aliases":["weight_alias"],"canonical_name":"weight","eligible":true,"group_id":"group_0000","order":0,"shape":[2,2]},{"aliases":[],"canonical_name":"bias","eligible":true,"group_id":"group_0000","order":1,"shape":[2]}],"runtime_layout_hash":"e859990d1b3d2fc370fdcc7bf1af8a6ba6a59b98ad9e6b7f80f075d705cb06f2"},"core_evidence_hash":"20135f8d6641e1acdeff60e0ab5ff2dd5ee2949da597c4aa15c7814e0d7f15f9","gate_status":"NOT_RUN","input_evidence":[],"local_validation_status":"PASS","role_evidence":{"decision_authority":"external_reviewer","gate_status":"NOT_RUN","role":"gate_candidate"},"schema_version":"stage01-task-evidence-v1","scope":"local_fixture","task_definition_hash":"da02079ee31a9938a613f3aef2d33bf8d24a4323d0f3cc5413aa1a9fff72bf2d","task_id":"stage1.02_architecture_and_parameter_registry"}
