{"artifact_role":"requirements_matrix","config_hash":"4fa450cda4622b65359cfc672c6a3483151bbaed77dc3df7cf5370015701f80b","core_evidence":{"contract_hashes":{"docs/mathematics.md":"0ee015fc1aed6110b064a436cbaa5a888e30d8201a697f75be9a8309dac9592a","plan/stage1/01_entry_and_contract.md":"e98b0f6d8fe66cc753bc9336da90ddc606618c185b6f758598f1815fdf8ef616"},"dynamic_learning_rate_in_coordinate_hash":false,"evidence_type":"stage1_math_contract","frozen_formulas":{"double":"mean_gradient_A*mean_gradient_B","equal_u":"(S1**2-S2)/(M*(M-1))","raw":"mean_gradient**2"},"same_batch_clipped_u_claim":"plugin_no_strict_unbiasedness","task_definition_hash":"c90fd2e169138487a5df170d171a541a8717daee26aa65a9202278e6d9ea48cc"},"core_evidence_hash":"4545b70e028b06cc28509470bda6c6474b44253b5602174136ed60f556db68f9","gate_status":"NOT_RUN","input_evidence":[],"local_validation_status":"PASS","role_evidence":{"artifact_contract":"stage1.01_entry_and_contract:requirements_matrix","role":"task_specific_evidence"},"schema_version":"stage01-task-evidence-v1","scope":"local_fixture","task_definition_hash":"c90fd2e169138487a5df170d171a541a8717daee26aa65a9202278e6d9ea48cc","task_id":"stage1.01_entry_and_contract"}
